{
  "overall_status": "needs_repair",
  "setup_summary": {
    "status": "ready",
    "reason": "local setup ready",
    "next_actions": [],
    "receipt_refs": [
      {
        "field": "setup",
        "kind": "setup_readiness",
        "path": null,
        "key": null
      }
    ]
  },
  "latest_run": {
    "run_id": "run_2026_05_18_171000",
    "report_path": "out/run_2026_05_18_171000/intake.report.json",
    "receipt_refs": [
      {
        "field": "latest_run.report",
        "kind": "intake_report",
        "path": "out/run_2026_05_18_171000/intake.report.json",
        "key": null
      }
    ]
  },
  "packet_readiness": {
    "status": "needs_repair",
    "reason": "manual evidence repair is available",
    "receipt_refs": [
      {
        "field": "packet_quality.packet_readiness",
        "kind": "intake_report",
        "path": "out/run_2026_05_18_171000/intake.report.json",
        "key": null
      }
    ]
  },
  "source_summary": {
    "included": [
      {
        "source_key": "manual",
        "source_label": "Manual journal",
        "event_count": 0
      },
      {
        "source_key": "git",
        "source_label": "Local git",
        "event_count": 4
      }
    ],
    "unavailable": [],
    "disabled": [],
    "receipt_refs": [
      {
        "field": "included_sources",
        "kind": "intake_report",
        "path": "out/run_2026_05_18_171000/intake.report.json",
        "key": null
      }
    ]
  },
  "repair_summary": {
    "open_items": 2,
    "safe_write_count": 1,
    "setup_blocked_write_count": 0,
    "applied_not_rerun": false,
    "receipt_refs": [
      {
        "field": "repair_items",
        "kind": "intake_report",
        "path": "out/run_2026_05_18_171000/intake.report.json",
        "key": null
      }
    ]
  },
  "diff_summary": {
    "status": "no_prior_comparable_run",
    "reason": "no prior comparable run",
    "receipt_refs": []
  },
  "share_summary": {
    "profiles": [
      {
        "profile_key": "manager",
        "profile_label": "Manager",
        "status": "blocked",
        "reason": "SHIPLOG_REDACT_KEY missing",
        "receipt_refs": [
          {
            "field": "share_profiles",
            "kind": "share_readiness",
            "path": null,
            "key": "manager"
          }
        ]
      }
    ],
    "receipt_refs": [
      {
        "field": "share_profiles",
        "kind": "share_readiness",
        "path": null,
        "key": null
      }
    ]
  },
  "blocking_reasons": [
    {
      "key": "repair_items_open",
      "label": "Repair items",
      "status": "needs_repair",
      "reason": "2 open repair items",
      "scope": "repair",
      "receipt_refs": [
        {
          "field": "repair_items",
          "kind": "intake_report",
          "path": "out/run_2026_05_18_171000/intake.report.json",
          "key": null
        }
      ]
    }
  ],
  "next_actions": [
    {
      "key": "repair_plan",
      "label": "Inspect repair plan",
      "command": "shiplog repair plan --latest",
      "writes": false,
      "reason": "inspect repair items before running write-producing repair",
      "preconditions": [
        "latest run available"
      ],
      "priority": 1,
      "receipt_refs": [
        {
          "field": "repair_items",
          "kind": "intake_report",
          "path": "out/run_2026_05_18_171000/intake.report.json",
          "key": null
        }
      ]
    },
    {
      "key": "journal_add_from_repair",
      "label": "Add local evidence from repair",
      "command": "shiplog journal add --from-repair <repair_id>",
      "writes": true,
      "reason": "local evidence repair is available",
      "preconditions": [
        "repair item is local-journal safe",
        "setup ready"
      ],
      "priority": 2,
      "receipt_refs": [
        {
          "field": "repair_items",
          "kind": "intake_report",
          "path": "out/run_2026_05_18_171000/intake.report.json",
          "key": "manual:no_events"
        }
      ]
    }
  ],
  "receipt_refs": [
    {
      "field": "latest_run.report",
      "kind": "intake_report",
      "path": "out/run_2026_05_18_171000/intake.report.json",
      "key": null
    }
  ]
}
